{
  "slug": "19-industrial-living-room",
  "cat": "residential",
  "type": "P1-interior",
  "complete": false,
  "project": {
    "name": "工业风住宅客厅 Industrial Loft Living · v1",
    "zh": "",
    "area": 60,
    "location": "Hong Kong",
    "budgetHKD": 360000,
    "style": "industrial-loft, raw-concrete, exposed-metal, warm-wood-accent, edison-bulb",
    "palette": [
      {
        "name": "concrete_grey",
        "hex": "#8C8C8C"
      },
      {
        "name": "raw_brick",
        "hex": "#A0522D"
      },
      {
        "name": "metal_black",
        "hex": "#1C1C1E"
      },
      {
        "name": "warm_wood",
        "hex": "#8B6914"
      },
      {
        "name": "leather_brown",
        "hex": "#6B3A2A"
      },
      {
        "name": "accent_amber",
        "hex": "#D4A017"
      }
    ]
  },
  "renders": [
    {
      "id": "01",
      "file": "/assets/mvps/19-industrial-living-room/renders/01_hero_corner.webp",
      "title": "01 Hero Corner",
      "tag": "01_hero_corner"
    },
    {
      "id": "02",
      "file": "/assets/mvps/19-industrial-living-room/renders/02_reception.webp",
      "title": "02 Reception",
      "tag": "02_reception"
    },
    {
      "id": "02",
      "file": "/assets/mvps/19-industrial-living-room/renders/02_reception_photorealistic.webp",
      "title": "02 Reception Photorealistic",
      "tag": "02_reception_photorealistic"
    },
    {
      "id": "03",
      "file": "/assets/mvps/19-industrial-living-room/renders/03_main_zone.webp",
      "title": "03 Main Zone",
      "tag": "03_main_zone"
    },
    {
      "id": "04",
      "file": "/assets/mvps/19-industrial-living-room/renders/04_feature_zone.webp",
      "title": "04 Feature Zone",
      "tag": "04_feature_zone"
    },
    {
      "id": "05",
      "file": "/assets/mvps/19-industrial-living-room/renders/05_lounge_zone.webp",
      "title": "05 Lounge Zone",
      "tag": "05_lounge_zone"
    },
    {
      "id": "06",
      "file": "/assets/mvps/19-industrial-living-room/renders/06_back_corner.webp",
      "title": "06 Back Corner",
      "tag": "06_back_corner"
    },
    {
      "id": "07",
      "file": "/assets/mvps/19-industrial-living-room/renders/07_top_ortho.webp",
      "title": "07 Top Ortho",
      "tag": "07_top_ortho"
    },
    {
      "id": "08",
      "file": "/assets/mvps/19-industrial-living-room/renders/08_birds_eye_3d.webp",
      "title": "08 Birds Eye 3D",
      "tag": "08_birds_eye_3d"
    }
  ],
  "floorplan": "/assets/mvps/19-industrial-living-room/floorplan.webp",
  "moodboard": "/assets/mvps/19-industrial-living-room/moodboard.webp",
  "hero_img": "/assets/mvps/19-industrial-living-room/hero.webp",
  "thumb_img": "/assets/mvps/19-industrial-living-room/thumb.webp",
  "zones": [
    {
      "id": "入口玄关",
      "name": "入口玄关",
      "zh": "",
      "area": 4,
      "notes": "铁艺鞋架, 墙挂衣钩, 地垫",
      "x": 0,
      "y": 0,
      "w": 20,
      "h": 20
    },
    {
      "id": "主沙发区",
      "name": "主沙发区",
      "zh": "",
      "area": 18,
      "notes": "3人皮质沙发, 单人扶手椅, 铁木茶几, 地毯, 落地灯",
      "x": 0,
      "y": 0,
      "w": 20,
      "h": 20
    },
    {
      "id": "电视墙",
      "name": "电视墙",
      "zh": "",
      "area": 6,
      "notes": "铁艺电视支架, 55寸电视, 工业风储物柜, 音响",
      "x": 0,
      "y": 0,
      "w": 20,
      "h": 20
    },
    {
      "id": "餐厅区",
      "name": "餐厅区",
      "zh": "",
      "area": 12,
      "notes": "铁木餐桌 1.8m, 4把工业风金属椅, 长条凳",
      "x": 0,
      "y": 0,
      "w": 20,
      "h": 20
    },
    {
      "id": "开放厨房吧台",
      "name": "开放厨房吧台",
      "zh": "",
      "area": 8,
      "notes": "水泥台面吧台, 2把旋转高脚凳, 吊架挂杯",
      "x": 0,
      "y": 0,
      "w": 20,
      "h": 20
    },
    {
      "id": "阅读角",
      "name": "阅读角",
      "zh": "",
      "area": 6,
      "notes": "铁管书架 5层, 皮质阅读椅, 台灯, 边桌",
      "x": 0,
      "y": 0,
      "w": 20,
      "h": 20
    },
    {
      "id": "室内绿植",
      "name": "室内绿植",
      "zh": "",
      "area": 3,
      "notes": "2×大型落地盆栽, 3×桌面小盆栽, 铁艺花架",
      "x": 0,
      "y": 0,
      "w": 20,
      "h": 20
    },
    {
      "id": "窗台休闲",
      "name": "窗台休闲",
      "zh": "",
      "area": 3,
      "notes": "窗台坐垫, 靠枕, 小型仙人掌",
      "x": 0,
      "y": 0,
      "w": 20,
      "h": 20
    }
  ],
  "furniture": [],
  "pricing": {
    "HK": {
      "label": "Hong Kong",
      "currency": "HK$",
      "perM2": 0,
      "rows": [],
      "total": "0",
      "totalNumber": 0,
      "subtotal": "0",
      "mep": "0",
      "prelim": "0",
      "cont": "0"
    }
  },
  "energy": {
    "eui": 0,
    "limit": 150,
    "annual": 0,
    "engine": "EnergyPlus"
  },
  "compliance": {
    "HK": {
      "code": "HK_BEEO_BEC_2021",
      "label": "HK · BEEO 2021",
      "checks": [],
      "items": [],
      "verdict": "—",
      "score": ""
    }
  },
  "variants": {
    "list": [
      {
        "id": "v1-modern",
        "name": "v1",
        "name_zh": "v1",
        "desc": "",
        "thumb": "/assets/mvps/19-industrial-living-room/variants/v1-modern/thumb.webp",
        "hero": "/assets/mvps/19-industrial-living-room/variants/v1-modern/hero.webp"
      },
      {
        "id": "v2-industrial",
        "name": "v1",
        "name_zh": "v1",
        "desc": "",
        "thumb": "/assets/mvps/19-industrial-living-room/variants/v2-industrial/thumb.webp",
        "hero": "/assets/mvps/19-industrial-living-room/variants/v2-industrial/hero.webp"
      },
      {
        "id": "v3-scandinavian",
        "name": "v1",
        "name_zh": "v1",
        "desc": "",
        "thumb": "/assets/mvps/19-industrial-living-room/variants/v3-scandinavian/thumb.webp",
        "hero": "/assets/mvps/19-industrial-living-room/variants/v3-scandinavian/hero.webp"
      }
    ]
  },
  "timeline": [],
  "decks": [],
  "downloads": [
    {
      "name": "19-industrial-living-room-bundle.zip",
      "ext": "zip",
      "sub": "All artifacts",
      "size": "TBD"
    }
  ],
  "editable": {
    "area_m2": 60,
    "insulation_mm": 60,
    "glazing_uvalue": 2.0,
    "lighting_cct": 3000,
    "lighting_density_w_m2": 6,
    "wwr": 0.25,
    "region": "HK"
  },
  "derived": {
    "eui_kwh_m2_yr": 0,
    "cost_total": 0,
    "cost_per_m2": 0,
    "co2_t_per_yr": 0
  }
}