{
  "slug": "07-bookstore",
  "cat": "residential",
  "type": "P1-interior",
  "complete": true,
  "project": {
    "name": "独立书店阅读空间 Page & Co · v1",
    "zh": "",
    "area": 100,
    "location": "Hong Kong",
    "budgetHKD": 0,
    "style": "cozy-warm, wood-heavy, vintage, library-quiet",
    "palette": [
      {
        "name": "wall_cream",
        "hex": "#F0E8D8"
      },
      {
        "name": "wood_deep",
        "hex": "#5C3E2E"
      },
      {
        "name": "brass_accent",
        "hex": "#B89968"
      },
      {
        "name": "ceramic_red",
        "hex": "#B5594A"
      },
      {
        "name": "forest_green",
        "hex": "#3A5A3F"
      },
      {
        "name": "ivory_page",
        "hex": "#F5F1E8"
      }
    ]
  },
  "renders": [
    {
      "id": "01",
      "file": "/assets/mvps/07-bookstore/renders/01_hero_corner.webp",
      "title": "01 Hero Corner",
      "tag": "01_hero_corner"
    },
    {
      "id": "02",
      "file": "/assets/mvps/07-bookstore/renders/02_reception.webp",
      "title": "02 Reception",
      "tag": "02_reception"
    },
    {
      "id": "03",
      "file": "/assets/mvps/07-bookstore/renders/03_main_zone.webp",
      "title": "03 Main Zone",
      "tag": "03_main_zone"
    },
    {
      "id": "04",
      "file": "/assets/mvps/07-bookstore/renders/04_feature_zone.webp",
      "title": "04 Feature Zone",
      "tag": "04_feature_zone"
    },
    {
      "id": "05",
      "file": "/assets/mvps/07-bookstore/renders/05_lounge_zone.webp",
      "title": "05 Lounge Zone",
      "tag": "05_lounge_zone"
    },
    {
      "id": "06",
      "file": "/assets/mvps/07-bookstore/renders/06_back_corner.webp",
      "title": "06 Back Corner",
      "tag": "06_back_corner"
    },
    {
      "id": "07",
      "file": "/assets/mvps/07-bookstore/renders/07_top_ortho.webp",
      "title": "07 Top Ortho",
      "tag": "07_top_ortho"
    },
    {
      "id": "08",
      "file": "/assets/mvps/07-bookstore/renders/08_birds_eye_3d.webp",
      "title": "08 Birds Eye 3D",
      "tag": "08_birds_eye_3d"
    }
  ],
  "floorplan": "/assets/mvps/07-bookstore/floorplan.webp",
  "moodboard": "/assets/mvps/07-bookstore/moodboard.webp",
  "hero_img": "/assets/mvps/07-bookstore/hero.webp",
  "thumb_img": "/assets/mvps/07-bookstore/thumb.webp",
  "zones": [
    {
      "id": "入口主柜_+_收银",
      "name": "入口主柜 + 收银",
      "zh": "",
      "area": 8,
      "notes": "主柜台, 收银位, 新刊展示, POS",
      "x": 0,
      "y": 0,
      "w": 20,
      "h": 20
    },
    {
      "id": "4_面书架墙",
      "name": "4 面书架墙",
      "zh": "",
      "area": 12,
      "notes": "4 × 高书架 (3m 高 × 6 层), 书籍 ≈ 28 展示堆",
      "x": 0,
      "y": 0,
      "w": 20,
      "h": 20
    },
    {
      "id": "中央展示桌",
      "name": "中央展示桌",
      "zh": "",
      "area": 6,
      "notes": "低方桌, 新书堆 × 4, 黄铜台灯",
      "x": 0,
      "y": 0,
      "w": 20,
      "h": 20
    },
    {
      "id": "阅读窗角",
      "name": "阅读窗角",
      "zh": "",
      "area": 10,
      "notes": "3 × 单人沙发, 圆形小茶几, 落地灯",
      "x": 0,
      "y": 0,
      "w": 20,
      "h": 20
    },
    {
      "id": "长桌阅读区",
      "name": "长桌阅读区",
      "zh": "",
      "area": 16,
      "notes": "4m 长木桌, 6 × 木椅, 2 × 桌面台灯",
      "x": 0,
      "y": 0,
      "w": 20,
      "h": 20
    },
    {
      "id": "活动小沙龙区",
      "name": "活动小沙龙区",
      "zh": "",
      "area": 12,
      "notes": "可摆 15 折叠椅, 演讲位",
      "x": 0,
      "y": 0,
      "w": 20,
      "h": 20
    },
    {
      "id": "卫生间_+_储物",
      "name": "卫生间 + 储物",
      "zh": "",
      "area": 6,
      "notes": "卫生间, 储物柜, 后勤",
      "x": 0,
      "y": 0,
      "w": 20,
      "h": 20
    },
    {
      "id": "室内绿植",
      "name": "室内绿植",
      "zh": "",
      "area": 2,
      "notes": "2 × 落地盆栽, 书架顶绿植",
      "x": 0,
      "y": 0,
      "w": 20,
      "h": 20
    }
  ],
  "furniture": [],
  "pricing": {
    "HK": {
      "label": "Hong Kong",
      "currency": "HK$",
      "perM2": 13438,
      "rows": [
        {
          "cat": "1",
          "desc": "slab",
          "sub": "F1 Floor Slab — RC slab (120mm) incl. formwork + rebar",
          "qty": "72.0",
          "amt": "m2"
        },
        {
          "cat": "2",
          "desc": "wall",
          "sub": "F1 Exterior Walls — Common brick wall (200mm) incl. render",
          "qty": "142.1",
          "amt": "m2"
        },
        {
          "cat": "3",
          "desc": "wall",
          "sub": "F1 Interior Partitions — Gypsum board partition (double-sided)",
          "qty": "67.2",
          "amt": "m2"
        },
        {
          "cat": "4",
          "desc": "window",
          "sub": "F1 Windows — Thermal-break aluminum + Low-E double glazing",
          "qty": "42.6",
          "amt": "m2"
        },
        {
          "cat": "5",
          "desc": "door",
          "sub": "F1 Doors — Solid wood door (900mm) + frame + hardware",
          "qty": "8.0",
          "amt": "ea"
        },
        {
          "cat": "6",
          "desc": "finish",
          "sub": "F1_zone Floor Finish — Ceramic tile floor (supply + install)",
          "qty": "8.0",
          "amt": "m2"
        },
        {
          "cat": "7",
          "desc": "finish",
          "sub": "F1_4 Floor Finish — Ceramic tile floor (supply + install)",
          "qty": "12.0",
          "amt": "m2"
        },
        {
          "cat": "8",
          "desc": "finish",
          "sub": "F1_zone_2 Floor Finish — Ceramic tile floor (supply + install)",
          "qty": "6.0",
          "amt": "m2"
        },
        {
          "cat": "9",
          "desc": "finish",
          "sub": "F1_zone_3 Floor Finish — Ceramic tile floor (supply + install)",
          "qty": "10.0",
          "amt": "m2"
        },
        {
          "cat": "10",
          "desc": "finish",
          "sub": "F1_zone_4 Floor Finish — Ceramic tile floor (supply + install)",
          "qty": "16.0",
          "amt": "m2"
        },
        {
          "cat": "11",
          "desc": "finish",
          "sub": "F1_zone_5 Floor Finish — Ceramic tile floor (supply + install)",
          "qty": "12.0",
          "amt": "m2"
        },
        {
          "cat": "12",
          "desc": "finish",
          "sub": "F1_bathroom Floor Finish — Ceramic tile floor (supply + install)",
          "qty": "6.0",
          "amt": "m2"
        },
        {
          "cat": "13",
          "desc": "finish",
          "sub": "F1_zone_6 Floor Finish — Ceramic tile floor (supply + install)",
          "qty": "2.0",
          "amt": "m2"
        },
        {
          "cat": "14",
          "desc": "roof",
          "sub": "Roof — RC roof slab + waterproofing + insulation",
          "qty": "99.6",
          "amt": "m2"
        }
      ],
      "total": 967567.84
    }
  },
  "energy": {
    "eui": 104.28,
    "limit": 150,
    "annual": 10386.12,
    "engine": "EnergyPlus"
  },
  "compliance": {
    "HK": {
      "code": "HK_BEEO_BEC_2021",
      "checks": [
        {
          "name": "Energy Energy Use Intensity (EUI)",
          "value": "104.3",
          "limit": "150",
          "unit": "kWh/m2*yr",
          "status": "pass",
          "note": "70% of limit"
        },
        {
          "name": "Envelope Exterior Wall U-value",
          "value": "0.555",
          "limit": "1.8",
          "unit": "W/m2K",
          "status": "pass",
          "note": ""
        },
        {
          "name": "Envelope Roof U-value",
          "value": "0.498",
          "limit": "0.8",
          "unit": "W/m2K",
          "status": "pass",
          "note": ""
        },
        {
          "name": "Envelope Window U-value",
          "value": "2.0",
          "limit": "5.8",
          "unit": "W/m2K",
          "status": "pass",
          "note": ""
        },
        {
          "name": "Envelope Window SHGC",
          "value": "0.6",
          "limit": "0.6",
          "unit": "—",
          "status": "pass",
          "note": ""
        },
        {
          "name": "Envelope OTTV (Overall Thermal Transfer Value)",
          "value": "needs facade analysis",
          "limit": "25.0",
          "unit": "W/m2",
          "status": "pass",
          "note": "OTTV requires detailed facade WWR + orientation data — not yet calculated."
        },
        {
          "name": "Lighting Lighting Power Density",
          "value": "8.0",
          "limit": "10.0",
          "unit": "W/m2",
          "status": "pass",
          "note": ""
        },
        {
          "name": "Ventilation Fresh Air (ACH)",
          "value": "0.7",
          "limit": "0.5",
          "unit": "ACH",
          "status": "pass",
          "note": ""
        }
      ],
      "verdict": "COMPLIANT"
    }
  },
  "variants": {
    "list": []
  },
  "timeline": [],
  "decks": [],
  "downloads": [
    {
      "name": "07-bookstore-bundle.zip",
      "ext": "zip",
      "sub": "All artifacts",
      "size": "TBD"
    }
  ],
  "editable": {
    "area_m2": 100,
    "insulation_mm": 60,
    "glazing_uvalue": 2.0,
    "lighting_cct": 3000,
    "lighting_density_w_m2": 6,
    "wwr": 0.25,
    "region": "HK"
  },
  "derived": {
    "eui_kwh_m2_yr": 104.3,
    "cost_total": 967568,
    "cost_per_m2": 13438,
    "co2_t_per_yr": 6.13
  }
}