{
  "slug": "16-elderly-friendly-home",
  "cat": "residential",
  "type": "P1-interior",
  "complete": false,
  "project": {
    "name": "长者友好居家改装",
    "zh": "",
    "area": 45,
    "location": "Hong Kong",
    "budgetHKD": 250000,
    "style": "温暖, 安全, 明亮, 简洁, 无障碍",
    "palette": [
      {
        "name": "primary",
        "hex": "#E8DCC8"
      },
      {
        "name": "secondary",
        "hex": "#8B7355"
      },
      {
        "name": "accent",
        "hex": "#C4956A"
      },
      {
        "name": "wall",
        "hex": "#FAF6F0"
      },
      {
        "name": "floor",
        "hex": "#D4C4AB"
      },
      {
        "name": "safety",
        "hex": "#D4A574"
      }
    ]
  },
  "renders": [
    {
      "id": "01",
      "file": "/assets/mvps/16-elderly-friendly-home/renders/01_hero_corner.webp",
      "title": "01 Hero Corner",
      "tag": "01_hero_corner"
    },
    {
      "id": "02",
      "file": "/assets/mvps/16-elderly-friendly-home/renders/02_reception.webp",
      "title": "02 Reception",
      "tag": "02_reception"
    },
    {
      "id": "03",
      "file": "/assets/mvps/16-elderly-friendly-home/renders/03_main_zone.webp",
      "title": "03 Main Zone",
      "tag": "03_main_zone"
    },
    {
      "id": "04",
      "file": "/assets/mvps/16-elderly-friendly-home/renders/04_feature_zone.webp",
      "title": "04 Feature Zone",
      "tag": "04_feature_zone"
    },
    {
      "id": "05",
      "file": "/assets/mvps/16-elderly-friendly-home/renders/05_lounge_zone.webp",
      "title": "05 Lounge Zone",
      "tag": "05_lounge_zone"
    },
    {
      "id": "06",
      "file": "/assets/mvps/16-elderly-friendly-home/renders/06_back_corner.webp",
      "title": "06 Back Corner",
      "tag": "06_back_corner"
    },
    {
      "id": "07",
      "file": "/assets/mvps/16-elderly-friendly-home/renders/07_top_ortho.webp",
      "title": "07 Top Ortho",
      "tag": "07_top_ortho"
    },
    {
      "id": "08",
      "file": "/assets/mvps/16-elderly-friendly-home/renders/08_birds_eye_3d.webp",
      "title": "08 Birds Eye 3D",
      "tag": "08_birds_eye_3d"
    }
  ],
  "floorplan": "/assets/mvps/16-elderly-friendly-home/floorplan.webp",
  "moodboard": "/assets/mvps/16-elderly-friendly-home/moodboard.webp",
  "hero_img": "/assets/mvps/16-elderly-friendly-home/hero.webp",
  "thumb_img": "/assets/mvps/16-elderly-friendly-home/thumb.webp",
  "zones": [
    {
      "id": "客厅+餐厅",
      "name": "客厅+餐厅",
      "zh": "",
      "area": 16,
      "notes": "",
      "x": 0,
      "y": 0,
      "w": 20,
      "h": 20
    },
    {
      "id": "主卧",
      "name": "主卧",
      "zh": "",
      "area": 10,
      "notes": "",
      "x": 0,
      "y": 0,
      "w": 20,
      "h": 20
    },
    {
      "id": "厨房",
      "name": "厨房",
      "zh": "",
      "area": 5,
      "notes": "",
      "x": 0,
      "y": 0,
      "w": 20,
      "h": 20
    },
    {
      "id": "浴室",
      "name": "浴室",
      "zh": "",
      "area": 4,
      "notes": "",
      "x": 0,
      "y": 0,
      "w": 20,
      "h": 20
    },
    {
      "id": "玄关",
      "name": "玄关",
      "zh": "",
      "area": 3,
      "notes": "",
      "x": 0,
      "y": 0,
      "w": 20,
      "h": 20
    },
    {
      "id": "储物间",
      "name": "储物间",
      "zh": "",
      "area": 2,
      "notes": "",
      "x": 0,
      "y": 0,
      "w": 20,
      "h": 20
    },
    {
      "id": "走廊",
      "name": "走廊",
      "zh": "",
      "area": 5,
      "notes": "",
      "x": 0,
      "y": 0,
      "w": 20,
      "h": 20
    }
  ],
  "furniture": [],
  "pricing": {
    "HK": {
      "label": "Hong Kong",
      "currency": "HK$",
      "perM2": 0,
      "rows": [
        {
          "cat": "1",
          "desc": "slab",
          "sub": "F1 Floor Slab — RC slab (120mm) incl. formwork + rebar",
          "qty": "45.0",
          "amt": "m2"
        },
        {
          "cat": "2",
          "desc": "wall",
          "sub": "F1 Exterior Walls — Brick wall no insulation (U>1.2, legacy)",
          "qty": "85.2",
          "amt": "m2"
        },
        {
          "cat": "3",
          "desc": "wall",
          "sub": "F1 Interior Partitions — Gypsum board partition (double-sided)",
          "qty": "50.4",
          "amt": "m2"
        },
        {
          "cat": "4",
          "desc": "window",
          "sub": "F1 Windows — Single glazing + aluminum frame (legacy)",
          "qty": "25.6",
          "amt": "m2"
        },
        {
          "cat": "5",
          "desc": "door",
          "sub": "F1 Doors — Solid wood door (900mm) + frame + hardware",
          "qty": "5.0",
          "amt": "ea"
        },
        {
          "cat": "6",
          "desc": "finish",
          "sub": "F1_living Floor Finish — Carpet with underlay",
          "qty": "16.0",
          "amt": "m2"
        },
        {
          "cat": "7",
          "desc": "finish",
          "sub": "F1_master_bed Floor Finish — Carpet with underlay",
          "qty": "10.0",
          "amt": "m2"
        },
        {
          "cat": "8",
          "desc": "finish",
          "sub": "F1_kitchen Floor Finish — Ceramic tile floor (supply + install)",
          "qty": "5.0",
          "amt": "m2"
        },
        {
          "cat": "9",
          "desc": "finish",
          "sub": "F1_zone Floor Finish — Ceramic tile floor (supply + install)",
          "qty": "4.0",
          "amt": "m2"
        },
        {
          "cat": "10",
          "desc": "finish",
          "sub": "F1_entry Floor Finish — Ceramic tile floor (supply + install)",
          "qty": "3.0",
          "amt": "m2"
        },
        {
          "cat": "11",
          "desc": "finish",
          "sub": "F1_zone_2 Floor Finish — Ceramic tile floor (supply + install)",
          "qty": "2.0",
          "amt": "m2"
        },
        {
          "cat": "12",
          "desc": "finish",
          "sub": "F1_corridor Floor Finish — Ceramic tile floor (supply + install)",
          "qty": "5.0",
          "amt": "m2"
        },
        {
          "cat": "13",
          "desc": "roof",
          "sub": "Roof — RC roof slab + waterproofing + insulation (U≤0.80)",
          "qty": "46.4",
          "amt": "m2"
        }
      ],
      "total": 0
    }
  },
  "energy": {
    "eui": 0,
    "limit": 150,
    "annual": 0,
    "engine": "EnergyPlus"
  },
  "compliance": {
    "HK": {
      "code": "HK_BEEO_BEC_2021",
      "checks": [
        {
          "name": "Energy Energy Use Intensity (EUI)",
          "value": "87.3",
          "limit": "150",
          "unit": "kWh/m2*yr",
          "status": "pass",
          "note": "58% of limit"
        },
        {
          "name": "Envelope Exterior Wall U-value",
          "value": "1.8",
          "limit": "1.8",
          "unit": "W/m2K",
          "status": "pass",
          "note": ""
        },
        {
          "name": "Envelope Roof U-value",
          "value": "0.8",
          "limit": "0.8",
          "unit": "W/m2K",
          "status": "pass",
          "note": ""
        },
        {
          "name": "Envelope Window U-value",
          "value": "5.8",
          "limit": "5.8",
          "unit": "W/m2K",
          "status": "pass",
          "note": ""
        },
        {
          "name": "Envelope Window SHGC",
          "value": "0.8",
          "limit": "0.6",
          "unit": "—",
          "status": "fail",
          "note": ""
        },
        {
          "name": "Envelope OTTV (Overall Thermal Transfer Value)",
          "value": "needs facade analysis",
          "limit": "25.0",
          "unit": "W/m2",
          "status": "pass",
          "note": "OTTV requires detailed facade WWR + orientation data — not yet calculated."
        },
        {
          "name": "Lighting Lighting Power Density",
          "value": "6.0",
          "limit": "10.0",
          "unit": "W/m2",
          "status": "pass",
          "note": ""
        },
        {
          "name": "HVAC HVAC COP (split_ac)",
          "value": "not specified",
          "limit": "3.0",
          "unit": "—",
          "status": "fail",
          "note": "COP not set in model — use 'model set-hvac' with COP"
        },
        {
          "name": "Ventilation Fresh Air (ACH)",
          "value": "0.5",
          "limit": "0.5",
          "unit": "ACH",
          "status": "pass",
          "note": ""
        }
      ],
      "verdict": "—"
    }
  },
  "variants": {
    "list": [
      {
        "id": "v1-basic-safety",
        "name": "Basic Safety",
        "name_zh": "",
        "desc": "",
        "thumb": "/assets/mvps/16-elderly-friendly-home/variants/v1-basic-safety/thumb.webp",
        "hero": "/assets/mvps/16-elderly-friendly-home/variants/v1-basic-safety/hero.webp"
      },
      {
        "id": "v2-smart-comfort",
        "name": "Smart Comfort",
        "name_zh": "",
        "desc": "",
        "thumb": "/assets/mvps/16-elderly-friendly-home/variants/v2-smart-comfort/thumb.webp",
        "hero": "/assets/mvps/16-elderly-friendly-home/variants/v2-smart-comfort/hero.webp"
      },
      {
        "id": "v3-full-accessibility",
        "name": "Full Accessibility",
        "name_zh": "",
        "desc": "",
        "thumb": "/assets/mvps/16-elderly-friendly-home/variants/v3-full-accessibility/thumb.webp",
        "hero": "/assets/mvps/16-elderly-friendly-home/variants/v3-full-accessibility/hero.webp"
      }
    ]
  },
  "timeline": [],
  "decks": [],
  "downloads": [
    {
      "name": "16-elderly-friendly-home-bundle.zip",
      "ext": "zip",
      "sub": "All artifacts",
      "size": "TBD"
    }
  ],
  "editable": {
    "area_m2": 45,
    "insulation_mm": 60,
    "glazing_uvalue": 2.0,
    "lighting_cct": 3000,
    "lighting_density_w_m2": 6,
    "wwr": 0.25,
    "region": "HK"
  },
  "derived": {
    "eui_kwh_m2_yr": 0,
    "cost_total": 0,
    "cost_per_m2": 0,
    "co2_t_per_yr": 0
  }
}